{
  "receipt_version": "0.1.0",
  "receipt_id": "e85d320c-3a99-4d9f-b917-f0ef86e7ab29",
  "time": {
    "requested_at": "2026-03-02T00:00:00Z",
    "decided_at": "2026-03-02T00:00:00Z",
    "completed_at": "2026-03-02T00:00:00Z"
  },
  "trace": {
    "trace_id": "c8ac9f2b-1e49-4c7c-9a9d-0f6e6a4b0c24",
    "step": 1
  },
  "actor": {
    "type": "agent",
    "id": "agent:demo",
    "display": "Demo Agent",
    "session_id": "sess-demo-001"
  },
  "notary": {
    "runtime": "IX-Agent-Notary",
    "version": "0.1.0-dev",
    "instance_id": "notary-local-001",
    "environment": "local"
  },
  "action": {
    "kind": "tool.invoke",
    "tool": "filesystem",
    "operation": "file.write",
    "parameters": {
      "path": "docs/approved.txt",
      "bytes": 7,
      "content_redacted": true
    },
    "parameters_hash": "sha256:Qm2jA6bJY1lq2R9tKQx3c3l9JYp6u0aXb3m3Pp0J7m4"
  },
  "policy": {
    "policy_id": "demo-policy-001",
    "decision": "allow",
    "reason": "path allowed (docs/*)",
    "rules": [
      {
        "rule_id": "allow-docs",
        "effect": "allow",
        "explanation": "allow docs/* writes"
      }
    ],
    "approvals": [
      {
        "approval_id": "f4e1d4c8-9f1f-4e0e-ae47-f5e9f9de9d0d",
        "type": "ticket",
        "status": "approved",
        "approver": {
          "type": "user",
          "id": "you@example.com",
          "display": "You"
        },
        "scope": {
          "kind": "tool.invoke",
          "tool": "filesystem",
          "operation": "file.write",
          "resource": "docs/approved.txt"
        },
        "time": {
          "requested_at": "2026-03-02T00:00:00Z",
          "decided_at": "2026-03-02T00:00:00Z"
        },
        "notes": "Demo ticket approval.",
        "signature": {
          "alg": "ed25519",
          "key_id": "dev-key-001",
          "value": "pxqvZ84nSl90WCQTniFDoF-wprtZeoaogbFlh5Kqp_TBQ-QwG6X-BfMKAH0n2bpwE75cJVhdxd6OO-ujWqV2BQ"
        }
      }
    ],
    "context_hashes": {
      "requested_path": "sha256:6Q3N9mR5UoVYq3oD1yqg9m5JcVwqjQkY2p0V5YpT8sQ"
    }
  },
  "result": {
    "status": "success",
    "summary": "Allowed filesystem file.write (simulated).",
    "output": {
      "path": "docs/approved.txt",
      "written": true,
      "content_redacted": true
    },
    "output_hash": "sha256:1Vh1qXq2Yg0jQw4rG0Kxg8Q4j9WfQwzqQv3mZl3lQpM"
  },
  "integrity": {
    "canonicalization": "RFC8785-JCS",
    "hash": {
      "alg": "sha-256",
      "encoding": "base64url"
    },
    "signature": {
      "alg": "ed25519",
      "key_id": "dev-key-001",
      "value": "mP-7qZlY7Sg5c0GkzZlqk7iH0o2j3w7JHq8xqJdQ7b0uF5wE8Jm5u1eT4n4pJ5cW7w8mHk7p3mGqv9Zt6d9AQ"
    }
  }
}
