{
  "receipt_version": "0.1.0",
  "receipt_id": "ba49f6a5-bed6-4d8e-887b-d49f52d415df",
  "time": {
    "requested_at": "2026-03-02T00:00:00Z",
    "decided_at": "2026-03-02T00:00:00Z",
    "completed_at": "2026-03-02T00:00:00Z"
  },
  "trace": {
    "trace_id": "5591c3dc-45c7-44ae-bcc5-08196421fb1a",
    "step": 1
  },
  "actor": {
    "type": "agent",
    "id": "agent:demo",
    "display": "Demo Agent",
    "session_id": "sess-demo-001"
  },
  "notary": {
    "runtime": "IX-Agent-Notary",
    "version": "0.1.0-dev",
    "instance_id": "notary-local-001",
    "environment": "local"
  },
  "action": {
    "kind": "tool.invoke",
    "tool": "filesystem",
    "operation": "file.write",
    "parameters": {
      "path": "docs/demo.txt",
      "bytes": 10,
      "content_redacted": true
    },
    "parameters_hash": "sha256:nzBG_2AYdPA-B9OAnOnol_ZeApZW_E1SV5IS0R01c00"
  },
  "policy": {
    "policy_id": "demo-policy-001",
    "decision": "allow",
    "reason": "path allowed (docs/*)",
    "rules": [
      {
        "rule_id": "allow-docs",
        "effect": "allow",
        "explanation": "allow docs/* writes"
      }
    ],
    "approvals": [],
    "context_hashes": {
      "requested_path": "sha256:zYspRruU8A5aZvUZyO9jfJgIDgPpAI6mSu0xJtQM-Zc"
    },
    "policy_hash": "sha256:i7EP3ZB8oVqP2XUXS7P_ywlTpvKzvO1EXkQk2N4C2EE",
    "policy_source": "policy/demo.policy.json"
  },
  "result": {
    "status": "success",
    "summary": "Allowed filesystem file.write (simulated).",
    "output": {
      "path": "docs/demo.txt",
      "written": true,
      "content_redacted": true
    },
    "output_hash": "sha256:LWqXYheR0f8y7lE4A4qT11yuhC7iT0Dda2WB-4O7rYo"
  },
  "integrity": {
    "canonicalization": "RFC8785-JCS",
    "hash": {
      "alg": "sha-256",
      "encoding": "base64url"
    },
    "signature": {
      "alg": "ed25519",
      "key_id": "dev-key-001",
      "value": "uzSJ5PdyY1J-OT4gaxV7w3bdffkzLQm6f0bnu-_4-N_KhVaeQpZ2HxlxwWkPDlKZ7WXL3m90LZ1NvNaN-C0oDw"
    }
  }
}
